{
  "version": "2026-08-08.1",
  "purpose": "Track legitimate editorial opportunities for verified research assets. No contacts have been imported or contacted.",
  "privacy_rule": "Store only public professional context needed to evaluate editorial fit; do not scrape or retain unnecessary personal information.",
  "statuses": ["research", "approved", "contacted", "declined", "linked", "do_not_contact"],
  "records": [
    {
      "opportunity_id": "O-2026-001",
      "domain": "buildingadvisor.com",
      "publication": "BuildingAdvisor",
      "relevant_url": "https://buildingadvisor.com/project-management/contracts/change-orders/",
      "author": null,
      "public_contact_method": null,
      "topic": "construction change orders and contract charges",
      "detecthiddenfees_asset": "/hidden-fee-database",
      "why_relevant": "The page explains that change orders can alter scope, price, and completion timing. The published evidence review includes authoritative home-improvement guidance and can add source context, but it is not a construction prevalence study.",
      "relevant_existing_article": "https://buildingadvisor.com/project-management/contracts/change-orders/",
      "suggested_outreach_angle": "Offer the evidence review as a primary-source companion for readers checking contract scope, estimates, and change-order charges; disclose that the current sample is not representative.",
      "confidence": "medium",
      "status": "approved",
      "date": "2026-08-08",
      "response": null,
      "mention_or_link": null,
      "source_evidence": "https://buildingadvisor.com/project-management/contracts/change-orders/"
    },
    {
      "opportunity_id": "O-2026-002",
      "domain": "caredge.com",
      "publication": "CarEdge",
      "relevant_url": "https://caredge.com/guides/understanding-car-dealer-fees",
      "author": null,
      "public_contact_method": null,
      "topic": "dealer fees and add-ons",
      "detecthiddenfees_asset": "/hidden-fee-database",
      "why_relevant": "The guide addresses dealer fees and transaction-level examples. The published review contains multiple CFPB and FTC records about F&I add-ons, document/preparation/delivery/market-adjustment fees, and unwanted add-ons, making it a relevant primary-source comparison.",
      "relevant_existing_article": "https://caredge.com/guides/understanding-car-dealer-fees",
      "suggested_outreach_angle": "Offer the automotive records and methodology as a source-linked companion that distinguishes government-set charges from negotiable dealer fees and add-ons.",
      "confidence": "medium",
      "status": "approved",
      "date": "2026-08-08",
      "response": null,
      "mention_or_link": null,
      "source_evidence": "https://caredge.com/guides/understanding-car-dealer-fees"
    },
    {
      "opportunity_id": "O-2026-003",
      "domain": "axios.com",
      "publication": "Axios",
      "relevant_url": "https://www.axios.com/2022/05/02/monthly-subscription-fees-car-buyers-balk",
      "author": null,
      "public_contact_method": null,
      "topic": "automotive subscription fees",
      "detecthiddenfees_asset": "/hidden-fee-database",
      "why_relevant": "The article covers recurring fees for vehicle features, but the current evidence review has only general subscription-renewal guidance and does not contain independent automotive-subscription pricing evidence.",
      "relevant_existing_article": "https://www.axios.com/2022/05/02/monthly-subscription-fees-car-buyers-balk",
      "suggested_outreach_angle": null,
      "confidence": "low",
      "status": "declined",
      "date": "2026-08-08",
      "response": null,
      "mention_or_link": null,
      "source_evidence": "https://www.axios.com/2022/05/02/monthly-subscription-fees-car-buyers-balk"
    },
    {
      "opportunity_id": "O-2026-004",
      "domain": "time.com",
      "publication": "TIME",
      "relevant_url": "https://time.com/6218046/new-car-prices-over-msrp/",
      "author": null,
      "public_contact_method": null,
      "topic": "vehicle paperwork and added charges",
      "detecthiddenfees_asset": "/hidden-fee-database",
      "why_relevant": "The article gives a consumer account of dealer fees and above-sticker pricing. The current source review does not add a sufficiently specific original dataset for that article, so it is not being pitched at this stage.",
      "relevant_existing_article": "https://time.com/6218046/new-car-prices-over-msrp/",
      "suggested_outreach_angle": null,
      "confidence": "low",
      "status": "declined",
      "date": "2026-08-08",
      "response": null,
      "mention_or_link": null,
      "source_evidence": "https://time.com/6218046/new-car-prices-over-msrp/"
    },
    {
      "opportunity_id": "O-2026-005",
      "domain": "consumerreports.org",
      "publication": "Consumer Reports",
      "relevant_url": "https://www.consumerreports.org/money/fees-billing/how-to-avoid-car-buying-fees-a7209896255/",
      "author": "Jon Linkov",
      "public_contact_method": null,
      "topic": "car-buying fees and dealer add-ons",
      "detecthiddenfees_asset": "/hidden-fee-database",
      "why_relevant": "The article distinguishes legitimate car-buying charges from contestable dealer add-ons. The Evidence Review contains CFPB records on preparation, origination, document, delivery, market-adjustment, F&I add-on, and possible add-on cancellation issues, with source-level limitations.",
      "relevant_existing_article": "https://www.consumerreports.org/money/fees-billing/how-to-avoid-car-buying-fees-a7209896255/",
      "suggested_outreach_angle": "Offer the automotive source records as a primary-source companion for readers checking dealer paperwork; do not present the 25-record review as a car-fee prevalence study.",
      "confidence": "high",
      "status": "approved",
      "date": "2026-08-08",
      "response": null,
      "mention_or_link": null,
      "source_evidence": "https://www.consumerreports.org/money/fees-billing/how-to-avoid-car-buying-fees-a7209896255/"
    },
    {
      "opportunity_id": "O-2026-006",
      "domain": "edmunds.com",
      "publication": "Edmunds",
      "relevant_url": "https://www.edmunds.com/car-buying/what-fees-should-you-pay.html",
      "author": "Ronald Montoya; Peter Gareffa",
      "public_contact_method": null,
      "topic": "mandatory, negotiable, and dealer vehicle fees",
      "detecthiddenfees_asset": "/hidden-fee-database",
      "why_relevant": "The guide explains mandatory fees, document fees, state differences, and negotiability. The Evidence Review adds CFPB source context that separates government-set taxes/title/registration from preparation, document, delivery, market-adjustment, and optional add-on charges.",
      "relevant_existing_article": "https://www.edmunds.com/car-buying/what-fees-should-you-pay.html",
      "suggested_outreach_angle": "Offer the linked CFPB records and methodology as a source-verification companion for its fee checklist and state-specific discussion.",
      "confidence": "high",
      "status": "approved",
      "date": "2026-08-08",
      "response": null,
      "mention_or_link": null,
      "source_evidence": "https://www.edmunds.com/car-buying/what-fees-should-you-pay.html"
    },
    {
      "opportunity_id": "O-2026-007",
      "domain": "procore.com",
      "publication": "Procore",
      "relevant_url": "https://www.procore.com/library/request-for-change-orders",
      "author": "Chris Poché",
      "public_contact_method": null,
      "topic": "construction change orders, scope, cost, and schedule",
      "detecthiddenfees_asset": "/hidden-fee-database",
      "why_relevant": "The article explains that change orders can alter contract cost, scope, and schedule and emphasizes approvals and documentation. The Evidence Review includes an official home-improvement estimate/contract record that can add source context for scope, written estimates, and added charges.",
      "relevant_existing_article": "https://www.procore.com/library/request-for-change-orders",
      "suggested_outreach_angle": "Offer the construction/home-services source record and methodology as a public-source companion for readers reviewing estimates and change-order documentation; disclose the sample limitation.",
      "confidence": "high",
      "status": "approved",
      "date": "2026-08-08",
      "response": null,
      "mention_or_link": null,
      "source_evidence": "https://www.procore.com/library/request-for-change-orders"
    },
    {
      "opportunity_id": "O-2026-008",
      "domain": "kiplinger.com",
      "publication": "Kiplinger",
      "relevant_url": "https://www.kiplinger.com/investing/economy/how-to-fight-the-annoyance-economy",
      "author": "Kim Clark",
      "public_contact_method": null,
      "topic": "junk fees, auto-renewals, subscriptions, and bill red flags",
      "detecthiddenfees_asset": "/hidden-fee-database",
      "why_relevant": "The article covers junk fees, automatic renewals, subscription charges, and contract or bill warning signs. The Evidence Review provides a bounded set of FTC, CFPB, CMS, and other public-source records across those issue types, with transparent limitations.",
      "relevant_existing_article": "https://www.kiplinger.com/investing/economy/how-to-fight-the-annoyance-economy",
      "suggested_outreach_angle": "Offer the evidence review as a source map for readers who want to inspect the underlying government guidance behind recurring, billing, and disclosure issues; avoid repeating the article's market estimates as DetectHiddenFees findings.",
      "confidence": "medium",
      "status": "approved",
      "date": "2026-08-08",
      "response": null,
      "mention_or_link": null,
      "source_evidence": "https://www.kiplinger.com/investing/economy/how-to-fight-the-annoyance-economy"
    },
    {
      "opportunity_id": "O-2026-009",
      "domain": "nerdwallet.com",